{
  "caveats": [
    "The bundle provides architectural evidence but does not include a direct user-facing demo or runtime benchmark, so effects are inferred from implementation/test structure rather than explicit end-user behavior docs."
  ],
  "confidence": "likely",
  "config_flags": [],
  "expected_effect": null,
  "how_to_try": null,
  "impact": "low",
  "kind": "behavior_change",
  "proof_points": [
    "The PR body states the new structure explicitly: `LocalProcess` is the real implementation, `RemoteProcess` is a thin network proxy, and `Environment` now exposes `ExecProcess`.",
    "`local_backend.rs` is removed and replaced by new `process.rs`, `local_process.rs`, and `remote_process.rs`, indicating a concrete local/remote split behind a shared `ExecProcess` trait.",
    "`environment.rs` is changed to hold an `Arc<dyn ExecProcess>` and initialize an execution strategy (local default with optional remote override), so consumers depend on a common process API.",
    "Server wiring adds `process_handler.rs` and updates `server/handler.rs` to delegate execution handling through that adapter, centralizing execution semantics.",
    "The new `exec_process.rs` test exercises process behavior for both local and remote modes, directly validating parity across backends."
  ],
  "slug": null,
  "summary": "PR #15233 refactors the exec-server process stack by extracting a shared process interface, wiring `Environment` and handlers to it, and adding explicit local and remote implementations plus shared execution tests.",
  "title": "Exec process layer now uses a shared local/remote abstraction",
  "watch_state": null,
  "why_it_matters": "The change reduces the chance of local and remote command-execution behavior diverging by enforcing a single process contract for both backends. That gives users more reliable command execution behavior and makes future runtime backend changes safer and less likely to introduce regressions."
}
