{
  "caveats": [],
  "confidence": "likely",
  "config_flags": [],
  "expected_effect": null,
  "how_to_try": null,
  "impact": "low",
  "kind": "behavior_change",
  "proof_points": [
    "The PR body says the new agent-graph representation is now used for both cascading agent close and cascading resume.",
    "The bundle adds a new `thread_spawn_edges` table plus `DirectionalThreadSpawnEdgeStatus` (`Open` and `Closed`), which shows parent-child agent relationships are now persisted as first-class state.",
    "The `close_agent` tool path switches to `agent_control.close_agent(...)`, and the tool description was updated to say it closes an agent \"and any open descendants,\" making descendant shutdown part of the user-visible contract.",
    "`agent/control.rs` and `control_tests.rs` add graph-aware lifecycle and resume coverage, which supports the PR's claim that subtree resume now uses the persisted agent network."
  ],
  "slug": "agent-trees-now-cascade-close-and-resume",
  "summary": "Merged PR #15056 adds persisted parent-child agent graph state so close and resume flows can apply to descendant agents instead of treating each agent as an isolated thread.",
  "title": "Agent trees now cascade close and resume",
  "watch_state": null,
  "why_it_matters": "Users working with nested agents are less likely to leave orphaned child agents behind when closing a parent, and resumed sessions can restore the same subtree structure instead of losing those relationships."
}
