{
  "caveats": [
    "Behavior is explicitly scoped to VSCode Terminal per PR body; other terminals may not auto-handle `file://` links the same way.",
    "The change is primarily a UX/path-format improvement, not a new image generation capability.",
    "A small unrelated filesystem initialization change (`Environment::default().get_filesystem()`) is present but not the user-facing headline."
  ],
  "confidence": "likely",
  "config_flags": [],
  "expected_effect": "Generated-image entries now present `Saved to` values as URI links, enabling easier direct opening of files in supported terminals and reducing manual path-copy steps.",
  "how_to_try": "Generate an image in the TUI workflow and inspect the resulting history row; verify the saved location is shown as a `file://...` path (e.g., `file:///tmp/ig-1.png`) in place of `/tmp/...`, then open it in VSCode Terminal.",
  "impact": "low",
  "kind": "behavior_change",
  "proof_points": [
    "Primary PR title/body says it adds full image paths so generated images are open-able in TUI, currently limited to VSCode Terminal.",
    "In `codex-rs/tui/src/chatwidget.rs` and `codex-rs/tui_app_server/src/chatwidget.rs`, image generation end handling now maps saved paths through `url::Url::from_file_path(...).to_string()`, producing URI-formatted paths.",
    "In both `codex-rs/tui/src/history_cell.rs` and `codex-rs/tui_app_server/src/history_cell.rs`, rendering changed from `saved_to` to `saved_path` and directly displays the formatted path string after `Saved to:`.",
    "Snapshot and test updates in TUI history outputs/tests replace `/tmp/ig-1.png` with `file:///tmp/ig-1.png`, showing the visible output change.",
    "Additional identical updates in both `codex-rs/tui` and `codex-rs/tui_app_server` indicate the behavior applies to both terminal UI variants."
  ],
  "slug": null,
  "summary": "PR #15154 updates Codex TUI output so image-generation history entries render saved image locations as full `file://` URIs (for example `file:///tmp/...`) instead of plain local paths, across both TUI binaries.",
  "title": "TUI image history now shows generated files as file URIs",
  "watch_state": null,
  "why_it_matters": "This makes generated images easier to open directly from the terminal history in environments that treat `file://` links as clickable resources, improving discoverability right after generation."
}
