{
  "caveats": [
    "Evidence points to significant internal modularity work, but no explicit user-facing behavioral delta is documented in the PR body.",
    "Patch excerpts are partial for some file moves, so end-to-end semantic equivalence is inferred from import/manifest rewiring rather than full method-by-method diff parity."
  ],
  "confidence": "likely",
  "config_flags": [],
  "expected_effect": null,
  "how_to_try": null,
  "impact": "low",
  "kind": "behavior_change",
  "proof_points": [
    "Primary PR body states the refactor goal: move `core/src/terminal.rs` and tests into a standalone `terminal-detection` crate and update direct consumers to depend on `codex-terminal-detection`.",
    "`codex-rs/Cargo.toml`, `codex-rs/Cargo.lock`, and multiple crate manifests (`codex-rs/cli/Cargo.toml`, `codex-rs/core/Cargo.toml`, `codex-rs/tui/Cargo.toml`, `codex-rs/tui_app_server/Cargo.toml`) now include `terminal-detection` as a workspace member/dependency.",
    "`codex-rs/core/src/lib.rs` removes the previous `pub mod terminal`, while `cli`, `core`, `tui`, `tui_app_server`, and MCP test code replace `codex_core::terminal::*` imports with `codex_terminal_detection::*`.",
    "`codex-rs/terminal-detection/BUILD.bazel` and `codex-rs/terminal-detection/Cargo.toml` are added, and terminal-related source/tests are moved (`src/lib.rs`, `src/terminal_tests.rs`) indicating the new crate boundary is active in repository structure."
  ],
  "slug": "openai-codex-pr-15216",
  "summary": "This PR refactors terminal-related code by extracting `core/src/terminal.rs` and its tests into a new `terminal-detection` workspace crate, then rewires CLI, core, TUI, TUI app server, and MCP-related code to consume the new crate through existing imports and dependency entries.",
  "title": "Move terminal utilities into a dedicated terminal-detection crate",
  "watch_state": null,
  "why_it_matters": "The change centralizes terminal detection and user-agent/terminal-type logic behind a single shared crate, which reduces duplicate terminal dependencies across binaries and should make terminal behavior updates easier to maintain consistently across the CLI and UI stacks. User-visible behavior is expected to remain unchanged, so the practical impact is mostly engineering hygiene and modularity."
}
