{
  "caveats": [
    "No functional tests are shown in the bundle, so integration impact is inferred from the reverted diff and surrounding headers workflow.",
    "This is explicitly a cleanup/revert; user-visible effects are likely subtle and environment-dependent."
  ],
  "confidence": "confirmed",
  "config_flags": [],
  "expected_effect": null,
  "how_to_try": null,
  "impact": "low",
  "kind": "behavior_change",
  "proof_points": [
    "Primary PR narrative is explicit: title is `Revert \"Forward session and turn headers to MCP HTTP requests\"` and body states it reverts `openai/codex#15011`.",
    "The revert commit is `bab2a28f26223da6a3a6f61bb9656d2f8d6cc4ee`, whose message matches the PR title and confirms intent.",
    "`codex-rs/core/src/codex.rs` removes `sync_mcp_request_headers_for_turn`, which was responsible for building/stashing turn- and session-derived request headers.",
    "`codex-rs/core/src/tasks/mod.rs` removes both the per-turn header sync call and turn-state header-clear calls, indicating the rollback of that lifecycle behavior.",
    "`codex-rs/core/src/mcp_connection_manager.rs` and `codex-rs/core/src/mcp_connection_manager_tests.rs` remove request-header storage/carrying state in `AsyncManagedClient` and related tests.",
    "`codex-rs/rmcp-client/src/rmcp_client.rs` removes request-scoped-header handling for JSON-RPC client messages, including the `message_uses_request_scoped_headers` logic."
  ],
  "slug": null,
  "summary": "This PR rolls back PR #15011\u2019s change that forwarded session and turn metadata as headers on MCP HTTP requests, restoring prior MCP request behavior.",
  "title": "Reverted MCP session/turn header forwarding",
  "watch_state": null,
  "why_it_matters": "It is a stabilization rollback: the revert removes a recently introduced request-header path that could alter MCP behavior for downstream MCP servers. Treating this as a behavior change is appropriate because it reverses a protocol-level transmission change that may have affected integrations, even though it does not add new capability."
}
