{
  "caveats": [
    "This is a narrow behavioral change for code-mode automation, not a broad end-user feature or UI change."
  ],
  "confidence": "confirmed",
  "config_flags": [],
  "expected_effect": null,
  "how_to_try": null,
  "impact": "low",
  "kind": "behavior_change",
  "proof_points": [
    "The PR-level narrative is explicit: `openai/codex#15100` is titled \"Add apply_patch code mode result\" and shipped as a merged PR-first change on 2026-03-18.",
    "`codex-rs/core/src/tools/context.rs` adds `ApplyPatchToolOutput`, including a dedicated `code_mode_result` implementation that returns an empty JSON object for code-mode callers.",
    "`codex-rs/core/src/tools/handlers/apply_patch.rs` switches `ApplyPatchHandler` from `FunctionToolOutput` to `ApplyPatchToolOutput`, wiring the new result behavior into the actual tool handler.",
    "`codex-rs/core/tests/suite/code_mode.rs` adds an integration assertion that the nested tool's second text item is `{}`, confirming the new result shape is intentional and tested."
  ],
  "slug": "apply-patch-code-mode-result-object",
  "summary": "Merged PR #15100 changes Codex's code-mode `apply_patch` path to return a dedicated result object instead of flowing through the generic function-tool output path.",
  "title": "Code-mode `apply_patch` now returns an explicit result object",
  "watch_state": null,
  "why_it_matters": "This makes nested `apply_patch` calls easier to handle programmatically in code mode. Automation can treat a successful patch as a deterministic tool result rather than relying only on side effects or generic output handling."
}
