{
  "caveats": [
    "This is explicitly temporary behavior with explicit intent to re-enable later once Windows support is verified."
  ],
  "confidence": "confirmed",
  "config_flags": [],
  "expected_effect": null,
  "how_to_try": null,
  "impact": "low",
  "kind": "behavior_change",
  "proof_points": [
    "Primary PR metadata identifies the change as \u201cDisable hooks on windows for now\u201d and includes a temporary-status body (\u201cWe'll verify a bit later... and re-enable\u201d).",
    "The modified file `codex-rs/hooks/src/engine/mod.rs` adds a `cfg!(windows)` early return that initializes `handlers` as empty and sets a `warnings` message stating hooks are disabled because lifecycle hooks are not yet supported on Windows.",
    "Bundle evidence shows exactly one commit (`933ef3ccbdeb1877f2f9ba45d1379826f4c63088`) with message \u201cdisable hooks on windows for now,\u201d and that commit is tied to the merged PR 15252.",
    "The patch shows no deletions and only additions around hook startup logic, indicating a targeted behavioral gate rather than broad refactoring."
  ],
  "slug": "openai-codex-pr-15252",
  "summary": "The PR changes hook initialization so Windows sessions skip lifecycle hook discovery and return with no hooks plus a warning, reflecting that `codex_hooks` is not supported on Windows yet.",
  "title": "Hooks are disabled on Windows sessions in Codex Rust hook engine",
  "watch_state": null,
  "why_it_matters": "This prevents Windows users from hitting unsupported-hook execution paths by failing safely with a clear warning, which is a user-facing behavior change that keeps sessions usable while hook support is incomplete on that platform."
}
