{
  "caveats": [],
  "confidence": "confirmed",
  "config_flags": [],
  "expected_effect": null,
  "how_to_try": null,
  "impact": "low",
  "kind": "behavior_change",
  "proof_points": [
    "The pull request description explicitly says it logs guardian-reviewed tool approvals as `source=automated_reviewer` while keeping user approvals as `source=user` and config approvals as `source=config`.",
    "`codex-rs/core/src/tools/orchestrator.rs` adds `ToolDecisionSource::AutomatedReviewer` and chooses it when `routes_approval_to_guardian(turn_ctx)` is true before calling `otel.tool_decision(...)`.",
    "`codex-rs/otel/src/lib.rs` extends `ToolDecisionSource` with an `AutomatedReviewer` enum variant so the new telemetry source is represented end-to-end.",
    "The single commit `a3dcc1d69412c7f72ef738a8ef86a84bf7915c69` contains the focused code changes in both the orchestrator and OpenTelemetry enum definitions."
  ],
  "slug": "openai-codex-pr-15201",
  "summary": "The change introduces a new `automated_reviewer` approval source in Codex\u2019s tool decision telemetry so guardian-reviewed approvals are emitted distinctly from user and config approvals.",
  "title": "Add automated reviewer as separate source for tool approval telemetry",
  "watch_state": null,
  "why_it_matters": "This improves observability and operator workflows by making approval provenance explicit in `codex.tool_decision` logs, reducing ambiguity when debugging policy decisions and investigating approval behavior in production."
}
