{
  "caveats": [
    "Primarily affects contributor and CI lint infrastructure rather than end-user runtime behavior.",
    "Behavioral value depends on developers consuming the updated `just` targets and CI workflows."
  ],
  "confidence": "confirmed",
  "config_flags": [],
  "expected_effect": "Linting uses the checked-in prebuilt package path, so normal local/CI runs avoid rebuilding the lint from source and no longer fail due to the Windows `RUSTUP_HOME`/toolchain naming assumptions the PR fixes.",
  "how_to_try": "Check out the PR version, run `just argument-comment-lint` (or CI `argument_comment_lint_prebuilt` path in `rust-ci.yml`), and confirm it executes via `tools/argument-comment-lint/run-prebuilt-linter.sh` with the DotSlash manifest.",
  "impact": "low",
  "kind": "behavior_change",
  "proof_points": [
    "PR #15199 body explicitly states the lint path is moving to the released DotSlash artifact for normal CI and `just` workflows, while preserving source-build for active lint development.",
    "The `files` changes include adding `tools/argument-comment-lint/argument-comment-lint` and `run-prebuilt-linter.sh`, plus wrapper behavior updates in `tools/argument-comment-lint/run.sh` and `src/bin/argument-comment-lint.rs` to normalize nightly toolchain naming and infer `RUSTUP_HOME` when needed.",
    "CI and task wiring changed to enforce this path: `.github/workflows/rust-ci.yml` is split into dedicated lint jobs and `justfile` routes `argument-comment-lint` to the prebuilt wrapper instead of the source wrapper.",
    "A follow-up evidence bundle commit (`a1b8effb15edfc337ba58215adc4d70f60c548ac`) adds compatibility fixes across Windows sandbox call sites to make the stricter lint clean on current code, supporting the PR\u2019s stated goal of a green prebuilt lint run."
  ],
  "slug": null,
  "summary": "PR #15199 retools the repository's standard argument-comment lint path to use a checked-in DotSlash package and introduces a separate source-build wrapper path, while fixing rustup/toolchain compatibility in the prebuilt runner.",
  "title": "Argument-comment lint now uses the released DotSlash artifact by default",
  "watch_state": null,
  "why_it_matters": "This reduces lint turnaround in normal dev and CI workflows by avoiding repeated source builds and making the lint job more deterministic. It also lowers environment-fragility on CI, especially Windows, by standardizing toolchain context handling for the shipped prebuilt lint package."
}
